{
  "claims": [
    {
      "claim_id": "CLM-0001",
      "confidence": "high",
      "does_not_prove": "Provider-side retention, generalized training, covert reuse, or intent.",
      "epistemic_status": "observed",
      "evidence": [
        {
          "evidence_grade": "locator_only",
          "locator": "Product sections on playbooks, standards, fallbacks, setup, and risk calibration",
          "locator_kind": "section_description",
          "source_id": "SRC-0001",
          "support_type": "paraphrase"
        },
        {
          "evidence_grade": "reproducible",
          "locator": "commercial-legal/skills/cold-start-interview/SKILL.md lines 23-25 and 72-74",
          "locator_kind": "path_lines",
          "source_id": "SRC-0002",
          "support_type": "code_observation"
        },
        {
          "evidence_grade": "reproducible",
          "locator": "commercial-legal/agents/deal-debrief.md lines 89-118",
          "locator_kind": "path_lines",
          "source_id": "SRC-0002",
          "support_type": "code_observation"
        },
        {
          "evidence_grade": "reproducible",
          "locator": "commercial-legal/agents/playbook-monitor.md lines 50-74 and 135-166",
          "locator_kind": "path_lines",
          "source_id": "SRC-0002",
          "support_type": "code_observation"
        },
        {
          "evidence_grade": "locator_only",
          "locator": "Captured sections on legal plugins, playbooks, precedent, and house style",
          "locator_kind": "captured_selector",
          "source_id": "SRC-0050",
          "support_type": "first_party_documented_design"
        },
        {
          "evidence_grade": "locator_only",
          "locator": "Captured sections on skills, subagents, playbooks, precedent, and house style",
          "locator_kind": "captured_selector",
          "source_id": "SRC-0051",
          "support_type": "first_party_documented_design"
        }
      ],
      "hypotheses": {
        "H0": "supports",
        "H1": "supports",
        "H2": "neutral"
      },
      "lifecycle": "active",
      "proposition": "The pinned repository and captured official product pages document a static design that invites legal users to encode playbooks, fallbacks, deviations, rationales, risk posture, and house style.",
      "publication_eligibility": "blocked_review",
      "repair_note": "Narrowed to observed static design; runtime split into CLM-0017. SRC-0002 path_lines bound to candidate chunks for cold-start/deal-debrief/playbook-monitor; publication remains blocked_review pending independent review.",
      "review_state": "candidate"
    },
    {
      "claim_id": "CLM-0002",
      "confidence": "high",
      "does_not_prove": "A hosted runtime never receives profile content through inference or a separate upload.",
      "epistemic_status": "observed",
      "evidence": [
        {
          "evidence_grade": "reproducible",
          "locator": "scripts/deploy-managed-agent.sh lines 75-190",
          "locator_kind": "path_lines",
          "source_id": "SRC-0002",
          "support_type": "code_observation"
        }
      ],
      "hypotheses": {
        "H0": "supports",
        "H1": "neutral",
        "H2": "weighs_against"
      },
      "lifecycle": "active",
      "proposition": "The official repository does not automatically upload a populated local practice profile, matter folder, deviation log, or proposal history through its Managed Agent deployment script.",
      "publication_eligibility": "eligible",
      "repair_note": "Migrated without substantive expansion; remains bounded by its evidence and does-not-prove field.",
      "review_state": "reviewed"
    },
    {
      "claim_id": "CLM-0003",
      "confidence": "high",
      "does_not_prove": "Technical compliance, zero processing, zero retention, or the terms of an executed customer agreement.",
      "epistemic_status": "counterevidence",
      "evidence": [
        {
          "evidence_grade": "reproducible",
          "locator": "Captured HTML Sections A.2, B, and E; content_sha256:573e1018aec92cc04fc1c60bce27959e8efeddb9d15ce76992fbadb31885b282; retrieved 2026-07-15T13:29:28Z",
          "locator_kind": "captured_selector",
          "source_id": "SRC-0005",
          "support_type": "first_party_documented_terms"
        }
      ],
      "hypotheses": {
        "H0": "supports",
        "H1": "neutral",
        "H2": "weighs_against"
      },
      "lifecycle": "active",
      "proposition": "Anthropic's public standard commercial terms prohibit model training on Customer Content by default and leave input/output ownership with the customer.",
      "publication_eligibility": "blocked_review",
      "repair_note": "Classified as contractual control and counterevidence to default-training allegations. Locator upgraded to the registered hash-bound commercial-terms capture; publication remains blocked pending independent review and customer-specific coverage confirmation.",
      "review_state": "candidate"
    },
    {
      "claim_id": "CLM-0004",
      "confidence": "high",
      "does_not_prove": "Retained material is used for generalized training or cross-customer productization.",
      "epistemic_status": "observed",
      "evidence": [
        {
          "evidence_grade": "reproducible",
          "locator": "Captured HTML API and data retention sections, feature eligibility table, stateful products, and ZDR exclusions; content_sha256:386dd211007587aa05ce59bb6869690c8c74976df8161d9fe57ad5d31e1de02e; retrieved 2026-07-15T13:12:19Z",
          "locator_kind": "captured_selector",
          "source_id": "SRC-0009",
          "support_type": "first_party_documented_design"
        }
      ],
      "hypotheses": {
        "H0": "supports",
        "H1": "supports",
        "H2": "neutral"
      },
      "lifecycle": "active",
      "proposition": "Registered official documentation describes feature-dependent retention and zero-data-retention policy boundaries for hosted services.",
      "publication_eligibility": "blocked_review",
      "repair_note": "Narrowed to documented feature policy; tenant-specific behavior is split into CLM-0018. SRC-0009 locator upgraded to the registered hash-bound retention-doc capture. SRC-0010 was removed from this claim's evidence set until a content-hash capture is registered. Publication remains blocked pending independent review.",
      "review_state": "candidate"
    },
    {
      "claim_id": "CLM-0005",
      "confidence": "high",
      "does_not_prove": "Ordinary commercial conversations are used by default or that raw connector content is always included.",
      "epistemic_status": "observed",
      "evidence": [
        {
          "evidence_grade": "locator_only",
          "locator": "Feedback and disabling-feedback sections",
          "locator_kind": "section_description",
          "source_id": "SRC-0007",
          "support_type": "paraphrase"
        }
      ],
      "hypotheses": {
        "H0": "neutral",
        "H1": "neutral",
        "H2": "supports"
      },
      "lifecycle": "active",
      "proposition": "Commercial feedback submission is a disclosed secondary-use path that can include the related conversation and support research, behavior analysis, and model training.",
      "publication_eligibility": "quarantined",
      "repair_note": "Quarantined until SRC-0007 is recaptured with a registered content hash. Dynamic conflict-watch source is not publication-eligible.",
      "review_state": "candidate"
    },
    {
      "claim_id": "CLM-0006",
      "confidence": "high",
      "does_not_prove": "Claude for Legal content is enrolled or that negotiated terms cannot differ.",
      "epistemic_status": "observed",
      "evidence": [
        {
          "evidence_grade": "locator_only",
          "locator": "Development Partner Program scope and opt-in/out sections (dated dynamic page; no registered content hash)",
          "locator_kind": "section_description",
          "source_id": "SRC-0008",
          "support_type": "paraphrase"
        }
      ],
      "hypotheses": {
        "H0": "neutral",
        "H1": "neutral",
        "H2": "supports"
      },
      "lifecycle": "active",
      "proposition": "The Development Partner Program is an explicit organization-wide opt-in path currently documented for first-party Claude Code input/output tokens, not a default Claude for Legal data-use rule.",
      "publication_eligibility": "blocked_review",
      "repair_note": "Documented opt-in partner-program path only. SRC-0008 lacks content-hash capture; blocked_review; does not prove Claude for Legal enrollment.",
      "review_state": "candidate"
    },
    {
      "claim_id": "CLM-0007",
      "confidence": "medium",
      "does_not_prove": "Identification, reconstruction, or cross-customer reuse of a particular firm's legal playbook.",
      "epistemic_status": "observed",
      "evidence": [
        {
          "evidence_grade": "locator_only",
          "locator": "Aggregate privacy-preserving usage analysis: method, privacy, and safety-investigation sections",
          "locator_kind": "section_description",
          "source_id": "SRC-0012",
          "support_type": "paraphrase"
        }
      ],
      "hypotheses": {
        "H0": "neutral",
        "H1": "supports",
        "H2": "supports"
      },
      "lifecycle": "active",
      "proposition": "Anthropic has demonstrated aggregate privacy-preserving analysis of business/API usage, but public evidence does not establish customer-specific law-firm ontology extraction.",
      "publication_eligibility": "blocked_review",
      "repair_note": "Locator tightened to registered source description. Remains blocked_review; does not establish customer-specific ontology extraction.",
      "review_state": "candidate"
    },
    {
      "claim_id": "CLM-0008",
      "confidence": "medium",